[
  {
    "project_title": "Basketball detection Computer Vision Dataset",
    "url": "https://universe.roboflow.com/basketball-dxal0/basketball-detection-t4nif",
    "author": "by msfad saf",
    "project_type": "N/A",
    "updated": "Go to Roboflow App\nUniverse Home\nSign In or Sign Up\nRoboflow App\nDocumentation\nUniverse\nBack\nBasketball detection\nObject Detection\nGENERAL\nOverview\nDATA\nImages\n49\nDataset\n4\nAnalytics\nDEPLOY\nModel\n0\nAPI Docs\n49 images\nBasketball detection Computer Vision Dataset\nBasketBall\n\nUpdated 2 months ago\n\nUse this Dataset\n0 stars\nTAGS\nObject Detection\nCLASSES (0)\nA description for this project has not been published yet.\nCite This Project\nLICENSE\nCC BY 4.0\n\nIf you use this dataset in a research paper, please cite it using the following BibTeX:\n\n@misc{\nbasketball-detection-t4nif_dataset,\ntitle = { Basketball detection Dataset },\ntype = { Open Source Dataset },\nauthor = { BasketBall },\nhowpublished = { \\url{ https://universe.roboflow.com/basketball-dxal0/basketball-detection-t4nif } },\nurl = { https://universe.roboflow.com/basketball-dxal0/basketball-detection-t4nif },\njournal = { Roboflow Universe },\npublisher = { Roboflow },\nyear = { 2025 },\nmonth = { aug },\nnote = { visited on 2025-10-25 },\n}\n\n\nSIMILAR PROJECTS\nSee More\nObject Detection\nModel\nyolov9\n4basler\nby msfad saf\n293 images\n6 models\nObject Detection\nrobocon\nby devansh\n696 images\nObject Detection\nModel\nyolov9\n747_IR\nby msfad saf\n307 images\n11 models\nObject Detection\nModel\nyolov8\nyolov8s\nsnap\nbasketball_image_v2\nby sagar panwar\n619 images\n3 models\nObject Detection\nModel\nsnap\nbasket\nby basket\n553 images\n1 model\n© 2025 Roboflow, Inc. All rights reserved.\nExplore Datasets and Models\nObject Detection\nImage Classification\nMultimodal\nInstance Segmentation\nResearch\nTrending\nExplore Use Cases\nConstruction\nDocuments\nManufacturing\nRobotics\nSelf Driving\nSports\nResources\nProduct Overview\nPricing\nDocumentation\nBlog\nYouTube\nSupport\nForum\nCompany\nCareers\nPress\nTerms of Use\nPrivacy",
    "mAP": "N/A",
    "precision": "N/A",
    "recall": "N/A",
    "training_images": "Go to Roboflow App\nUniverse Home\nSign In or Sign Up\nRoboflow App\nDocumentation\nUniverse\nBack\nBasketball detection\nObject Detection\nGENERAL\nOverview\nDATA\nImages\n49\nDataset\n4\nAnalytics\nDEPLOY\nModel\n0\nAPI Docs\n49 images\nBasketball detection Computer Vision Dataset\nBasketBall\n\nUpdated 2 months ago\n\nUse this Dataset\n0 stars\nTAGS\nObject Detection\nCLASSES (0)\nA description for this project has not been published yet.\nCite This Project\nLICENSE\nCC BY 4.0\n\nIf you use this dataset in a research paper, please cite it using the following BibTeX:\n\n@misc{\nbasketball-detection-t4nif_dataset,\ntitle = { Basketball detection Dataset },\ntype = { Open Source Dataset },\nauthor = { BasketBall },\nhowpublished = { \\url{ https://universe.roboflow.com/basketball-dxal0/basketball-detection-t4nif } },\nurl = { https://universe.roboflow.com/basketball-dxal0/basketball-detection-t4nif },\njournal = { Roboflow Universe },\npublisher = { Roboflow },\nyear = { 2025 },\nmonth = { aug },\nnote = { visited on 2025-10-25 },\n}\n\n\nSIMILAR PROJECTS\nSee More\nObject Detection\nModel\nyolov9\n4basler\nby msfad saf\n293 images\n6 models\nObject Detection\nrobocon\nby devansh\n696 images\nObject Detection\nModel\nyolov9\n747_IR\nby msfad saf\n307 images\n11 models\nObject Detection\nModel\nyolov8\nyolov8s\nsnap\nbasketball_image_v2\nby sagar panwar\n619 images\n3 models\nObject Detection\nModel\nsnap\nbasket\nby basket\n553 images\n1 model\n© 2025 Roboflow, Inc. All rights reserved.\nExplore Datasets and Models\nObject Detection\nImage Classification\nMultimodal\nInstance Segmentation\nResearch\nTrending\nExplore Use Cases\nConstruction\nDocuments\nManufacturing\nRobotics\nSelf Driving\nSports\nResources\nProduct Overview\nPricing\nDocumentation\nBlog\nYouTube\nSupport\nForum\nCompany\nCareers\nPress\nTerms of Use\nPrivacy",
    "tags": [],
    "classes": [
      "Overview",
      "Images",
      "Dataset",
      "Analytics",
      "Model",
      "API Docs"
    ],
    "description": "N/A",
    "api_endpoint": "@misc{\nbasketball-detection-t4nif_dataset,\ntitle = { Basketball detection Dataset },\ntype = { Open Source Dataset },\nauthor = { BasketBall },\nhowpublished = { \\url{ https://universe.roboflow.com/basketball-dxal0/basketball-detection-t4nif } },\nurl = { https://universe.roboflow.com/basketball-dxal0/basketball-detection-t4nif },\njournal = { Roboflow Universe },\npublisher = { Roboflow },\nyear = { 2025 },\nmonth = { aug },\nnote = { visited on 2025-10-25 },\n}\n",
    "model_identifier": "@misc{basketball-detection-t4nif_dataset,title = { Basketball detection Dataset },type = { Open Source Dataset },author = { BasketBall },howpublished = { \\url{ https://universe.roboflow.com/basketball-dxal0/basketball-detection-t4nif } },url = { https://universe.roboflow.com/basketball-dxal0/basketball-detection-t4nif },journal = { Roboflow Universe },publisher = { Roboflow },year = { 2025 },month = { aug },note = { visited on 2025-10-25 },}"
  },
  {
    "project_title": "Basketball Detection Computer Vision Model",
    "url": "https://universe.roboflow.com/hobbys-dmlrg/basketball-detection-1mtj3",
    "author": "by Bits12",
    "project_type": "N/A",
    "updated": "Go to Roboflow App\nUniverse Home\nSign In or Sign Up\nRoboflow App\nDocumentation\nUniverse\nBack\nBasketball Detection\nObject Detection\nGENERAL\nOverview\nDATA\nImages\n4545\nDataset\n2\nAnalytics\nDEPLOY\nModel\n1\nAPI Docs\n4.5k images\nBasketball Detection Computer Vision Model\nHobbys\n\nUpdated a year ago\n\nUse this Model\nUse this Dataset\n1 star\nTAGS\nObject Detection\nModel\nsnap\nCLASSES (1)\nball\nMETRICS\nmAP@50 \n46.0%\nPrecision \n94.7%\nRecall \n42.0%\nTry This Model\nDrop an image or\nbrowse your device\nA description for this project has not been published yet.\nCite This Project\nLICENSE\nCC BY 4.0\n\nIf you use this dataset in a research paper, please cite it using the following BibTeX:\n\n\n@misc{\nbasketball-detection-1mtj3_dataset,\ntitle = { Basketball Detection Dataset },\ntype = { Open Source Dataset },\nauthor = { Hobbys },\nhowpublished = { \\url{ https://universe.roboflow.com/hobbys-dmlrg/basketball-detection-1mtj3 } },\nurl = { https://universe.roboflow.com/hobbys-dmlrg/basketball-detection-1mtj3 },\njournal = { Roboflow Universe },\npublisher = { Roboflow },\nyear = { 2024 },\nmonth = { oct },\nnote = { visited on 2025-10-26 },\n}\n\n\nSIMILAR PROJECTS\nSee More\nObject Detection\nModel\nsnap\nTEST\nby Bits12\n200 images\n1 model\nObject Detection\nModel\nsnap\nbasketball\nby jxk\n199 images\n1 model\nObject Detection\nMy yolov9\nby yutong chen\n341 images\nObject Detection\nObject Detection v1\nby New Model v1\n128 images\nObject Detection\nModel\nsnap\nBALL\nby project\n188 images\n1 model\n© 2025 Roboflow, Inc. All rights reserved.\nExplore Datasets and Models\nObject Detection\nImage Classification\nMultimodal\nInstance Segmentation\nResearch\nTrending\nExplore Use Cases\nConstruction\nDocuments\nManufacturing\nRobotics\nSelf Driving\nSports\nResources\nProduct Overview\nPricing\nDocumentation\nBlog\nYouTube\nSupport\nForum\nCompany\nCareers\nPress\nTerms of Use\nPrivacy",
    "mAP": "Go to Roboflow App\nUniverse Home\nSign In or Sign Up\nRoboflow App\nDocumentation\nUniverse\nBack\nBasketball Detection\nObject Detection\nGENERAL\nOverview\nDATA\nImages\n4545\nDataset\n2\nAnalytics\nDEPLOY\nModel\n1\nAPI Docs\n4.5k images\nBasketball Detection Computer Vision Model\nHobbys\n\nUpdated a year ago\n\nUse this Model\nUse this Dataset\n1 star\nTAGS\nObject Detection\nModel\nsnap\nCLASSES (1)\nball\nMETRICS\nmAP@50 \n46.0%\nPrecision \n94.7%\nRecall \n42.0%\nTry This Model\nDrop an image or\nbrowse your device\nA description for this project has not been published yet.\nCite This Project\nLICENSE\nCC BY 4.0\n\nIf you use this dataset in a research paper, please cite it using the following BibTeX:\n\n\n@misc{\nbasketball-detection-1mtj3_dataset,\ntitle = { Basketball Detection Dataset },\ntype = { Open Source Dataset },\nauthor = { Hobbys },\nhowpublished = { \\url{ https://universe.roboflow.com/hobbys-dmlrg/basketball-detection-1mtj3 } },\nurl = { https://universe.roboflow.com/hobbys-dmlrg/basketball-detection-1mtj3 },\njournal = { Roboflow Universe },\npublisher = { Roboflow },\nyear = { 2024 },\nmonth = { oct },\nnote = { visited on 2025-10-26 },\n}\n\n\nSIMILAR PROJECTS\nSee More\nObject Detection\nModel\nsnap\nTEST\nby Bits12\n200 images\n1 model\nObject Detection\nModel\nsnap\nbasketball\nby jxk\n199 images\n1 model\nObject Detection\nMy yolov9\nby yutong chen\n341 images\nObject Detection\nObject Detection v1\nby New Model v1\n128 images\nObject Detection\nModel\nsnap\nBALL\nby project\n188 images\n1 model\n© 2025 Roboflow, Inc. All rights reserved.\nExplore Datasets and Models\nObject Detection\nImage Classification\nMultimodal\nInstance Segmentation\nResearch\nTrending\nExplore Use Cases\nConstruction\nDocuments\nManufacturing\nRobotics\nSelf Driving\nSports\nResources\nProduct Overview\nPricing\nDocumentation\nBlog\nYouTube\nSupport\nForum\nCompany\nCareers\nPress\nTerms of Use\nPrivacy",
    "precision": "Go to Roboflow App\nUniverse Home\nSign In or Sign Up\nRoboflow App\nDocumentation\nUniverse\nBack\nBasketball Detection\nObject Detection\nGENERAL\nOverview\nDATA\nImages\n4545\nDataset\n2\nAnalytics\nDEPLOY\nModel\n1\nAPI Docs\n4.5k images\nBasketball Detection Computer Vision Model\nHobbys\n\nUpdated a year ago\n\nUse this Model\nUse this Dataset\n1 star\nTAGS\nObject Detection\nModel\nsnap\nCLASSES (1)\nball\nMETRICS\nmAP@50 \n46.0%\nPrecision \n94.7%\nRecall \n42.0%\nTry This Model\nDrop an image or\nbrowse your device\nA description for this project has not been published yet.\nCite This Project\nLICENSE\nCC BY 4.0\n\nIf you use this dataset in a research paper, please cite it using the following BibTeX:\n\n\n@misc{\nbasketball-detection-1mtj3_dataset,\ntitle = { Basketball Detection Dataset },\ntype = { Open Source Dataset },\nauthor = { Hobbys },\nhowpublished = { \\url{ https://universe.roboflow.com/hobbys-dmlrg/basketball-detection-1mtj3 } },\nurl = { https://universe.roboflow.com/hobbys-dmlrg/basketball-detection-1mtj3 },\njournal = { Roboflow Universe },\npublisher = { Roboflow },\nyear = { 2024 },\nmonth = { oct },\nnote = { visited on 2025-10-26 },\n}\n\n\nSIMILAR PROJECTS\nSee More\nObject Detection\nModel\nsnap\nTEST\nby Bits12\n200 images\n1 model\nObject Detection\nModel\nsnap\nbasketball\nby jxk\n199 images\n1 model\nObject Detection\nMy yolov9\nby yutong chen\n341 images\nObject Detection\nObject Detection v1\nby New Model v1\n128 images\nObject Detection\nModel\nsnap\nBALL\nby project\n188 images\n1 model\n© 2025 Roboflow, Inc. All rights reserved.\nExplore Datasets and Models\nObject Detection\nImage Classification\nMultimodal\nInstance Segmentation\nResearch\nTrending\nExplore Use Cases\nConstruction\nDocuments\nManufacturing\nRobotics\nSelf Driving\nSports\nResources\nProduct Overview\nPricing\nDocumentation\nBlog\nYouTube\nSupport\nForum\nCompany\nCareers\nPress\nTerms of Use\nPrivacy",
    "recall": "Go to Roboflow App\nUniverse Home\nSign In or Sign Up\nRoboflow App\nDocumentation\nUniverse\nBack\nBasketball Detection\nObject Detection\nGENERAL\nOverview\nDATA\nImages\n4545\nDataset\n2\nAnalytics\nDEPLOY\nModel\n1\nAPI Docs\n4.5k images\nBasketball Detection Computer Vision Model\nHobbys\n\nUpdated a year ago\n\nUse this Model\nUse this Dataset\n1 star\nTAGS\nObject Detection\nModel\nsnap\nCLASSES (1)\nball\nMETRICS\nmAP@50 \n46.0%\nPrecision \n94.7%\nRecall \n42.0%\nTry This Model\nDrop an image or\nbrowse your device\nA description for this project has not been published yet.\nCite This Project\nLICENSE\nCC BY 4.0\n\nIf you use this dataset in a research paper, please cite it using the following BibTeX:\n\n\n@misc{\nbasketball-detection-1mtj3_dataset,\ntitle = { Basketball Detection Dataset },\ntype = { Open Source Dataset },\nauthor = { Hobbys },\nhowpublished = { \\url{ https://universe.roboflow.com/hobbys-dmlrg/basketball-detection-1mtj3 } },\nurl = { https://universe.roboflow.com/hobbys-dmlrg/basketball-detection-1mtj3 },\njournal = { Roboflow Universe },\npublisher = { Roboflow },\nyear = { 2024 },\nmonth = { oct },\nnote = { visited on 2025-10-26 },\n}\n\n\nSIMILAR PROJECTS\nSee More\nObject Detection\nModel\nsnap\nTEST\nby Bits12\n200 images\n1 model\nObject Detection\nModel\nsnap\nbasketball\nby jxk\n199 images\n1 model\nObject Detection\nMy yolov9\nby yutong chen\n341 images\nObject Detection\nObject Detection v1\nby New Model v1\n128 images\nObject Detection\nModel\nsnap\nBALL\nby project\n188 images\n1 model\n© 2025 Roboflow, Inc. All rights reserved.\nExplore Datasets and Models\nObject Detection\nImage Classification\nMultimodal\nInstance Segmentation\nResearch\nTrending\nExplore Use Cases\nConstruction\nDocuments\nManufacturing\nRobotics\nSelf Driving\nSports\nResources\nProduct Overview\nPricing\nDocumentation\nBlog\nYouTube\nSupport\nForum\nCompany\nCareers\nPress\nTerms of Use\nPrivacy",
    "training_images": "Go to Roboflow App\nUniverse Home\nSign In or Sign Up\nRoboflow App\nDocumentation\nUniverse\nBack\nBasketball Detection\nObject Detection\nGENERAL\nOverview\nDATA\nImages\n4545\nDataset\n2\nAnalytics\nDEPLOY\nModel\n1\nAPI Docs\n4.5k images\nBasketball Detection Computer Vision Model\nHobbys\n\nUpdated a year ago\n\nUse this Model\nUse this Dataset\n1 star\nTAGS\nObject Detection\nModel\nsnap\nCLASSES (1)\nball\nMETRICS\nmAP@50 \n46.0%\nPrecision \n94.7%\nRecall \n42.0%\nTry This Model\nDrop an image or\nbrowse your device\nA description for this project has not been published yet.\nCite This Project\nLICENSE\nCC BY 4.0\n\nIf you use this dataset in a research paper, please cite it using the following BibTeX:\n\n\n@misc{\nbasketball-detection-1mtj3_dataset,\ntitle = { Basketball Detection Dataset },\ntype = { Open Source Dataset },\nauthor = { Hobbys },\nhowpublished = { \\url{ https://universe.roboflow.com/hobbys-dmlrg/basketball-detection-1mtj3 } },\nurl = { https://universe.roboflow.com/hobbys-dmlrg/basketball-detection-1mtj3 },\njournal = { Roboflow Universe },\npublisher = { Roboflow },\nyear = { 2024 },\nmonth = { oct },\nnote = { visited on 2025-10-26 },\n}\n\n\nSIMILAR PROJECTS\nSee More\nObject Detection\nModel\nsnap\nTEST\nby Bits12\n200 images\n1 model\nObject Detection\nModel\nsnap\nbasketball\nby jxk\n199 images\n1 model\nObject Detection\nMy yolov9\nby yutong chen\n341 images\nObject Detection\nObject Detection v1\nby New Model v1\n128 images\nObject Detection\nModel\nsnap\nBALL\nby project\n188 images\n1 model\n© 2025 Roboflow, Inc. All rights reserved.\nExplore Datasets and Models\nObject Detection\nImage Classification\nMultimodal\nInstance Segmentation\nResearch\nTrending\nExplore Use Cases\nConstruction\nDocuments\nManufacturing\nRobotics\nSelf Driving\nSports\nResources\nProduct Overview\nPricing\nDocumentation\nBlog\nYouTube\nSupport\nForum\nCompany\nCareers\nPress\nTerms of Use\nPrivacy",
    "tags": [],
    "classes": [
      "Overview",
      "Images",
      "Dataset",
      "Analytics",
      "Model",
      "API Docs",
      "ball",
      "ball"
    ],
    "description": "Drop an image or\nbrowse your device",
    "api_endpoint": "@misc{\nbasketball-detection-1mtj3_dataset,\ntitle = { Basketball Detection Dataset },\ntype = { Open Source Dataset },\nauthor = { Hobbys },\nhowpublished = { \\url{ https://universe.roboflow.com/hobbys-dmlrg/basketball-detection-1mtj3 } },\nurl = { https://universe.roboflow.com/hobbys-dmlrg/basketball-detection-1mtj3 },\njournal = { Roboflow Universe },\npublisher = { Roboflow },\nyear = { 2024 },\nmonth = { oct },\nnote = { visited on 2025-10-26 },\n}\n",
    "model_identifier": "@misc{basketball-detection-1mtj3_dataset,title = { Basketball Detection Dataset },type = { Open Source Dataset },author = { Hobbys },howpublished = { \\url{ https://universe.roboflow.com/hobbys-dmlrg/basketball-detection-1mtj3 } },url = { https://universe.roboflow.com/hobbys-dmlrg/basketball-detection-1mtj3 },journal = { Roboflow Universe },publisher = { Roboflow },year = { 2024 },month = { oct },note = { visited on 2025-10-26 },}"
  },
  {
    "project_title": "Basketball Computer Vision Dataset",
    "url": "https://universe.roboflow.com/swetha-saseendran/basketball-oznoj",
    "author": "by ARaround",
    "project_type": "N/A",
    "updated": "Go to Roboflow App\nUniverse Home\nSign In or Sign Up\nRoboflow App\nDocumentation\nUniverse\nBack\nBasketball\nObject Detection\nGENERAL\nOverview\nDATA\nImages\n76\nDataset\n3\nAnalytics\nDEPLOY\nModel\n0\nAPI Docs\n76 images\nBasketball Computer Vision Dataset\nSwetha Saseendran\n\nUpdated 4 years ago\n\nUse this Dataset\n0 stars\n\n105\n\nviews\n\n9\n\ndownloads\nTAGS\nObject Detection\nCLASSES (0)\nA description for this project has not been published yet.\nCite This Project\nLICENSE\nCC BY 4.0\n\nIf you use this dataset in a research paper, please cite it using the following BibTeX:\n\n@misc{\nbasketball-oznoj_dataset,\ntitle = { Basketball Dataset },\ntype = { Open Source Dataset },\nauthor = { Swetha Saseendran },\nhowpublished = { \\url{ https://universe.roboflow.com/swetha-saseendran/basketball-oznoj } },\nurl = { https://universe.roboflow.com/swetha-saseendran/basketball-oznoj },\njournal = { Roboflow Universe },\npublisher = { Roboflow },\nyear = { 2022 },\nmonth = { mar },\nnote = { visited on 2025-10-26 },\n}\n\n\nSIMILAR PROJECTS\nSee More\nObject Detection\nBasketAndBall\nby ARaround\n50 images\nObject Detection\nModel\nsnap\nMy First Project１\nby Basketball Detection\n271 images\n1 model\nObject Detection\nModel\nyolov11\nyolov11s\nBasketball Identification\nby Nolan Object Identification\n35 images\n8 models\nObject Detection\nBasketball_Detection\nby BasketballDetection\n57 images\nInstance Segmentation\nModel\nroboflow-3-n-seg\nLATIHAN\nby experiment\n99 images\n1 model\n© 2025 Roboflow, Inc. All rights reserved.\nExplore Datasets and Models\nObject Detection\nImage Classification\nMultimodal\nInstance Segmentation\nResearch\nTrending\nExplore Use Cases\nConstruction\nDocuments\nManufacturing\nRobotics\nSelf Driving\nSports\nResources\nProduct Overview\nPricing\nDocumentation\nBlog\nYouTube\nSupport\nForum\nCompany\nCareers\nPress\nTerms of Use\nPrivacy",
    "mAP": "N/A",
    "precision": "N/A",
    "recall": "N/A",
    "training_images": "Go to Roboflow App\nUniverse Home\nSign In or Sign Up\nRoboflow App\nDocumentation\nUniverse\nBack\nBasketball\nObject Detection\nGENERAL\nOverview\nDATA\nImages\n76\nDataset\n3\nAnalytics\nDEPLOY\nModel\n0\nAPI Docs\n76 images\nBasketball Computer Vision Dataset\nSwetha Saseendran\n\nUpdated 4 years ago\n\nUse this Dataset\n0 stars\n\n105\n\nviews\n\n9\n\ndownloads\nTAGS\nObject Detection\nCLASSES (0)\nA description for this project has not been published yet.\nCite This Project\nLICENSE\nCC BY 4.0\n\nIf you use this dataset in a research paper, please cite it using the following BibTeX:\n\n@misc{\nbasketball-oznoj_dataset,\ntitle = { Basketball Dataset },\ntype = { Open Source Dataset },\nauthor = { Swetha Saseendran },\nhowpublished = { \\url{ https://universe.roboflow.com/swetha-saseendran/basketball-oznoj } },\nurl = { https://universe.roboflow.com/swetha-saseendran/basketball-oznoj },\njournal = { Roboflow Universe },\npublisher = { Roboflow },\nyear = { 2022 },\nmonth = { mar },\nnote = { visited on 2025-10-26 },\n}\n\n\nSIMILAR PROJECTS\nSee More\nObject Detection\nBasketAndBall\nby ARaround\n50 images\nObject Detection\nModel\nsnap\nMy First Project１\nby Basketball Detection\n271 images\n1 model\nObject Detection\nModel\nyolov11\nyolov11s\nBasketball Identification\nby Nolan Object Identification\n35 images\n8 models\nObject Detection\nBasketball_Detection\nby BasketballDetection\n57 images\nInstance Segmentation\nModel\nroboflow-3-n-seg\nLATIHAN\nby experiment\n99 images\n1 model\n© 2025 Roboflow, Inc. All rights reserved.\nExplore Datasets and Models\nObject Detection\nImage Classification\nMultimodal\nInstance Segmentation\nResearch\nTrending\nExplore Use Cases\nConstruction\nDocuments\nManufacturing\nRobotics\nSelf Driving\nSports\nResources\nProduct Overview\nPricing\nDocumentation\nBlog\nYouTube\nSupport\nForum\nCompany\nCareers\nPress\nTerms of Use\nPrivacy",
    "tags": [],
    "classes": [
      "Overview",
      "Images",
      "Dataset",
      "Analytics",
      "Model",
      "API Docs"
    ],
    "description": "N/A",
    "api_endpoint": "@misc{\nbasketball-oznoj_dataset,\ntitle = { Basketball Dataset },\ntype = { Open Source Dataset },\nauthor = { Swetha Saseendran },\nhowpublished = { \\url{ https://universe.roboflow.com/swetha-saseendran/basketball-oznoj } },\nurl = { https://universe.roboflow.com/swetha-saseendran/basketball-oznoj },\njournal = { Roboflow Universe },\npublisher = { Roboflow },\nyear = { 2022 },\nmonth = { mar },\nnote = { visited on 2025-10-26 },\n}\n",
    "model_identifier": "@misc{basketball-oznoj_dataset,title = { Basketball Dataset },type = { Open Source Dataset },author = { Swetha Saseendran },howpublished = { \\url{ https://universe.roboflow.com/swetha-saseendran/basketball-oznoj } },url = { https://universe.roboflow.com/swetha-saseendran/basketball-oznoj },journal = { Roboflow Universe },publisher = { Roboflow },year = { 2022 },month = { mar },note = { visited on 2025-10-26 },}"
  },
  {
    "project_title": "basketball Computer Vision Dataset",
    "url": "https://universe.roboflow.com/basketball-u5lsh/basketball-sh9gz",
    "author": "by New Workspace",
    "project_type": "@misc{\nbasketball-sh9gz_dataset,\ntitle = { basketball Dataset },\ntype = { Open Source Dataset },\nauthor = { basketball },\nhowpublished = { \\url{ https://universe.roboflow.com/basketball-u5lsh/basketball-sh9gz } },\nurl = { https://universe.roboflow.com/basketball-u5lsh/basketball-sh9gz },\njournal = { Roboflow Universe },\npublisher = { Roboflow },\nyear = { 2024 },\nmonth = { aug },\nnote = { visited on 2025-10-26 },\n}",
    "updated": "Go to Roboflow App\nUniverse Home\nSign In or Sign Up\nRoboflow App\nDocumentation\nUniverse\nBack\nbasketball\nObject Detection\nGENERAL\nOverview\nDATA\nImages\n44\nDataset\n1\nAnalytics\nDEPLOY\nModel\n0\nAPI Docs\n44 images\nbasketball Computer Vision Dataset\nbasketball\n\nUpdated a year ago\n\nUse this Dataset\n0 stars\nTAGS\nObject Detection\nCLASSES (0)\nA description for this project has not been published yet.\nCite This Project\nLICENSE\nCC BY 4.0\n\nIf you use this dataset in a research paper, please cite it using the following BibTeX:\n\n\n\n@misc{\nbasketball-sh9gz_dataset,\ntitle = { basketball Dataset },\ntype = { Open Source Dataset },\nauthor = { basketball },\nhowpublished = { \\url{ https://universe.roboflow.com/basketball-u5lsh/basketball-sh9gz } },\nurl = { https://universe.roboflow.com/basketball-u5lsh/basketball-sh9gz },\njournal = { Roboflow Universe },\npublisher = { Roboflow },\nyear = { 2024 },\nmonth = { aug },\nnote = { visited on 2025-10-26 },\n}\n\n\nSIMILAR PROJECTS\nSee More\nObject Detection\nModel\nbasketball\nby New Workspace\n1540 images\n1 model\nObject Detection\nModel\nsnap\nyolov12\nyolov12n\nyolov11\nyolov11n\ndetection bola\nby FYP 210885\n301 images\n6 models\nObject Detection\nyolov9_\nby yolo\n400 images\nObject Detection\nModel\nyolov8\nyolov8s\nsnap\nSport-Items\nby Lollipop\n1367 images\n1 model\nObject Detection\nModel\nw210tracer\nby w251\n872 images\n1 model\n© 2025 Roboflow, Inc. All rights reserved.\nExplore Datasets and Models\nObject Detection\nImage Classification\nMultimodal\nInstance Segmentation\nResearch\nTrending\nExplore Use Cases\nConstruction\nDocuments\nManufacturing\nRobotics\nSelf Driving\nSports\nResources\nProduct Overview\nPricing\nDocumentation\nBlog\nYouTube\nSupport\nForum\nCompany\nCareers\nPress\nTerms of Use\nPrivacy",
    "mAP": "N/A",
    "precision": "N/A",
    "recall": "N/A",
    "training_images": "Go to Roboflow App\nUniverse Home\nSign In or Sign Up\nRoboflow App\nDocumentation\nUniverse\nBack\nbasketball\nObject Detection\nGENERAL\nOverview\nDATA\nImages\n44\nDataset\n1\nAnalytics\nDEPLOY\nModel\n0\nAPI Docs\n44 images\nbasketball Computer Vision Dataset\nbasketball\n\nUpdated a year ago\n\nUse this Dataset\n0 stars\nTAGS\nObject Detection\nCLASSES (0)\nA description for this project has not been published yet.\nCite This Project\nLICENSE\nCC BY 4.0\n\nIf you use this dataset in a research paper, please cite it using the following BibTeX:\n\n\n\n@misc{\nbasketball-sh9gz_dataset,\ntitle = { basketball Dataset },\ntype = { Open Source Dataset },\nauthor = { basketball },\nhowpublished = { \\url{ https://universe.roboflow.com/basketball-u5lsh/basketball-sh9gz } },\nurl = { https://universe.roboflow.com/basketball-u5lsh/basketball-sh9gz },\njournal = { Roboflow Universe },\npublisher = { Roboflow },\nyear = { 2024 },\nmonth = { aug },\nnote = { visited on 2025-10-26 },\n}\n\n\nSIMILAR PROJECTS\nSee More\nObject Detection\nModel\nbasketball\nby New Workspace\n1540 images\n1 model\nObject Detection\nModel\nsnap\nyolov12\nyolov12n\nyolov11\nyolov11n\ndetection bola\nby FYP 210885\n301 images\n6 models\nObject Detection\nyolov9_\nby yolo\n400 images\nObject Detection\nModel\nyolov8\nyolov8s\nsnap\nSport-Items\nby Lollipop\n1367 images\n1 model\nObject Detection\nModel\nw210tracer\nby w251\n872 images\n1 model\n© 2025 Roboflow, Inc. All rights reserved.\nExplore Datasets and Models\nObject Detection\nImage Classification\nMultimodal\nInstance Segmentation\nResearch\nTrending\nExplore Use Cases\nConstruction\nDocuments\nManufacturing\nRobotics\nSelf Driving\nSports\nResources\nProduct Overview\nPricing\nDocumentation\nBlog\nYouTube\nSupport\nForum\nCompany\nCareers\nPress\nTerms of Use\nPrivacy",
    "tags": [
      "@misc{\nbasketball-sh9gz_dataset,\ntitle = { basketball Dataset },\ntype = { Open Source Dataset },\nauthor = { basketball },\nhowpublished = { \\url{ https://universe.roboflow.com/basketball-u5lsh/basketball-sh9gz } },\nurl = { https://universe.roboflow.com/basketball-u5lsh/basketball-sh9gz },\njournal = { Roboflow Universe },\npublisher = { Roboflow },\nyear = { 2024 },\nmonth = { aug },\nnote = { visited on 2025-10-26 },\n}",
      "highlighted",
      "{{language}}",
      "{{language}}"
    ],
    "classes": [
      "Overview",
      "Images",
      "Dataset",
      "Analytics",
      "Model",
      "API Docs"
    ],
    "description": "N/A",
    "api_endpoint": "@misc{\nbasketball-sh9gz_dataset,\ntitle = { basketball Dataset },\ntype = { Open Source Dataset },\nauthor = { basketball },\nhowpublished = { \\url{ https://universe.roboflow.com/basketball-u5lsh/basketball-sh9gz } },\nurl = { https://universe.roboflow.com/basketball-u5lsh/basketball-sh9gz },\njournal = { Roboflow Universe },\npublisher = { Roboflow },\nyear = { 2024 },\nmonth = { aug },\nnote = { visited on 2025-10-26 },\n}\n",
    "model_identifier": "@misc{basketball-sh9gz_dataset,title = { basketball Dataset },type = { Open Source Dataset },author = { basketball },howpublished = { \\url{ https://universe.roboflow.com/basketball-u5lsh/basketball-sh9gz } },url = { https://universe.roboflow.com/basketball-u5lsh/basketball-sh9gz },journal = { Roboflow Universe },publisher = { Roboflow },year = { 2024 },month = { aug },note = { visited on 2025-10-26 },}"
  },
  {
    "project_title": "BasketBall Computer Vision Model",
    "url": "https://universe.roboflow.com/robotics-j2du8/basketball-0dp0m",
    "author": "by rodney.virtualassistant@gmail.com",
    "project_type": "Sports",
    "updated": "Go to Roboflow App\nUniverse Home\nSign In or Sign Up\nRoboflow App\nDocumentation\nUniverse\nBack\nBasketBall\nObject Detection\nGENERAL\nOverview\nDATA\nImages\n171\nDataset\n1\nAnalytics\nDEPLOY\nModel\n1\nAPI Docs\n171 images\nBasketBall Computer Vision Model\nRobotics\n\nUpdated a year ago\n\nUse this Model\nUse this Dataset\n0 stars\nTAGS\nObject Detection\nModel\nsnap\nCLASSES (0)\nMETRICS\nTry This Model\nDrop an image or\nbrowse your device\nA description for this project has not been published yet.\nCite This Project\nLICENSE\nCC BY 4.0\n\nIf you use this dataset in a research paper, please cite it using the following BibTeX:\n\n@misc{\nbasketball-0dp0m_dataset,\ntitle = { BasketBall Dataset },\ntype = { Open Source Dataset },\nauthor = { Robotics },\nhowpublished = { \\url{ https://universe.roboflow.com/robotics-j2du8/basketball-0dp0m } },\nurl = { https://universe.roboflow.com/robotics-j2du8/basketball-0dp0m },\njournal = { Roboflow Universe },\npublisher = { Roboflow },\nyear = { 2024 },\nmonth = { sep },\nnote = { visited on 2025-10-24 },\n}\n\n\nSIMILAR PROJECTS\nSee More\nObject Detection\nBASKETBALL ANNOTATION PROJECT\nby rodney.virtualassistant@gmail.com\n300 images\nObject Detection\nModel\nSports\nBasketball\nbasketball\nby 034 GANESH KUMAR M V CS\n300 images\n1 model\nObject Detection\nbball\nby Luca\n50 images\nObject Detection\nModel\nsnap\nbball_detector\nby mcf\n300 images\n1 model\nObject Detection\nModel\nsnap\nbasketball\nby THU\n210 images\n1 model\n© 2025 Roboflow, Inc. All rights reserved.\nExplore Datasets and Models\nObject Detection\nImage Classification\nMultimodal\nInstance Segmentation\nResearch\nTrending\nExplore Use Cases\nConstruction\nDocuments\nManufacturing\nRobotics\nSelf Driving\nSports\nResources\nProduct Overview\nPricing\nDocumentation\nBlog\nYouTube\nSupport\nForum\nCompany\nCareers\nPress\nTerms of Use\nPrivacy",
    "mAP": "N/A",
    "precision": "N/A",
    "recall": "N/A",
    "training_images": "Go to Roboflow App\nUniverse Home\nSign In or Sign Up\nRoboflow App\nDocumentation\nUniverse\nBack\nBasketBall\nObject Detection\nGENERAL\nOverview\nDATA\nImages\n171\nDataset\n1\nAnalytics\nDEPLOY\nModel\n1\nAPI Docs\n171 images\nBasketBall Computer Vision Model\nRobotics\n\nUpdated a year ago\n\nUse this Model\nUse this Dataset\n0 stars\nTAGS\nObject Detection\nModel\nsnap\nCLASSES (0)\nMETRICS\nTry This Model\nDrop an image or\nbrowse your device\nA description for this project has not been published yet.\nCite This Project\nLICENSE\nCC BY 4.0\n\nIf you use this dataset in a research paper, please cite it using the following BibTeX:\n\n@misc{\nbasketball-0dp0m_dataset,\ntitle = { BasketBall Dataset },\ntype = { Open Source Dataset },\nauthor = { Robotics },\nhowpublished = { \\url{ https://universe.roboflow.com/robotics-j2du8/basketball-0dp0m } },\nurl = { https://universe.roboflow.com/robotics-j2du8/basketball-0dp0m },\njournal = { Roboflow Universe },\npublisher = { Roboflow },\nyear = { 2024 },\nmonth = { sep },\nnote = { visited on 2025-10-24 },\n}\n\n\nSIMILAR PROJECTS\nSee More\nObject Detection\nBASKETBALL ANNOTATION PROJECT\nby rodney.virtualassistant@gmail.com\n300 images\nObject Detection\nModel\nSports\nBasketball\nbasketball\nby 034 GANESH KUMAR M V CS\n300 images\n1 model\nObject Detection\nbball\nby Luca\n50 images\nObject Detection\nModel\nsnap\nbball_detector\nby mcf\n300 images\n1 model\nObject Detection\nModel\nsnap\nbasketball\nby THU\n210 images\n1 model\n© 2025 Roboflow, Inc. All rights reserved.\nExplore Datasets and Models\nObject Detection\nImage Classification\nMultimodal\nInstance Segmentation\nResearch\nTrending\nExplore Use Cases\nConstruction\nDocuments\nManufacturing\nRobotics\nSelf Driving\nSports\nResources\nProduct Overview\nPricing\nDocumentation\nBlog\nYouTube\nSupport\nForum\nCompany\nCareers\nPress\nTerms of Use\nPrivacy",
    "tags": [
      "Sports",
      "Basketball"
    ],
    "classes": [
      "Overview",
      "Images",
      "Dataset",
      "Analytics",
      "Model",
      "API Docs"
    ],
    "description": "Drop an image or\nbrowse your device",
    "api_endpoint": "@misc{\nbasketball-0dp0m_dataset,\ntitle = { BasketBall Dataset },\ntype = { Open Source Dataset },\nauthor = { Robotics },\nhowpublished = { \\url{ https://universe.roboflow.com/robotics-j2du8/basketball-0dp0m } },\nurl = { https://universe.roboflow.com/robotics-j2du8/basketball-0dp0m },\njournal = { Roboflow Universe },\npublisher = { Roboflow },\nyear = { 2024 },\nmonth = { sep },\nnote = { visited on 2025-10-24 },\n}\n",
    "model_identifier": "@misc{basketball-0dp0m_dataset,title = { BasketBall Dataset },type = { Open Source Dataset },author = { Robotics },howpublished = { \\url{ https://universe.roboflow.com/robotics-j2du8/basketball-0dp0m } },url = { https://universe.roboflow.com/robotics-j2du8/basketball-0dp0m },journal = { Roboflow Universe },publisher = { Roboflow },year = { 2024 },month = { sep },note = { visited on 2025-10-24 },}"
  },
  {
    "project_title": "Shoot Detection Basketball Computer Vision Dataset",
    "url": "https://universe.roboflow.com/basketball-oatw2/shoot-detection-basketball-83v91",
    "author": "by KTAivle5",
    "project_type": "False Positive",
    "updated": "Go to Roboflow App\nUniverse Home\nSign In or Sign Up\nRoboflow App\nDocumentation\nUniverse\nBack\nShoot Detection Basketball\nObject Detection\nGENERAL\nOverview\nDATA\nImages\n1745\nDataset\n0\nAnalytics\nDEPLOY\nModel\n0\nAPI Docs\n1.7k images\nShoot Detection Basketball Computer Vision Dataset\nBasketball\n\nUpdated 2 months ago\n\nUse this Dataset\n0 stars\nTAGS\nObject Detection\nCLASSES (7)\n0\n1\n2\n3\n4\n5\n6\nA description for this project has not been published yet.\nCite This Project\nLICENSE\nCC BY 4.0\n\nIf you use this dataset in a research paper, please cite it using the following BibTeX:\n\n@misc{\nshoot-detection-basketball-83v91_dataset,\ntitle = { Shoot Detection Basketball Dataset },\ntype = { Open Source Dataset },\nauthor = { Basketball },\nhowpublished = { \\url{ https://universe.roboflow.com/basketball-oatw2/shoot-detection-basketball-83v91 } },\nurl = { https://universe.roboflow.com/basketball-oatw2/shoot-detection-basketball-83v91 },\njournal = { Roboflow Universe },\npublisher = { Roboflow },\nyear = { 2025 },\nmonth = { aug },\nnote = { visited on 2025-10-26 },\n}\n\n\nSIMILAR PROJECTS\nSee More\nObject Detection\naivle5_kim2\nby KTAivle5\n77 images\nClassification\nModel\nscore-no-score -single\nby Gaddy Radom\n596 images\n1 model\nObject Detection\nModel\nsnap\nyolov5\nyolov11\nyolov11n\nyolov8\nyolov8n\nopencv_abu\nby yolotest\n6137 images\n12 models\nObject Detection\nbasketball arc project\nby Lorcans projects\n731 images\nObject Detection\nModel\nsnap\nFalse Positive\nHead detect\nby jask\n9585 images\n1 model\n© 2025 Roboflow, Inc. All rights reserved.\nExplore Datasets and Models\nObject Detection\nImage Classification\nMultimodal\nInstance Segmentation\nResearch\nTrending\nExplore Use Cases\nConstruction\nDocuments\nManufacturing\nRobotics\nSelf Driving\nSports\nResources\nProduct Overview\nPricing\nDocumentation\nBlog\nYouTube\nSupport\nForum\nCompany\nCareers\nPress\nTerms of Use\nPrivacy",
    "mAP": "N/A",
    "precision": "N/A",
    "recall": "N/A",
    "training_images": "Go to Roboflow App\nUniverse Home\nSign In or Sign Up\nRoboflow App\nDocumentation\nUniverse\nBack\nShoot Detection Basketball\nObject Detection\nGENERAL\nOverview\nDATA\nImages\n1745\nDataset\n0\nAnalytics\nDEPLOY\nModel\n0\nAPI Docs\n1.7k images\nShoot Detection Basketball Computer Vision Dataset\nBasketball\n\nUpdated 2 months ago\n\nUse this Dataset\n0 stars\nTAGS\nObject Detection\nCLASSES (7)\n0\n1\n2\n3\n4\n5\n6\nA description for this project has not been published yet.\nCite This Project\nLICENSE\nCC BY 4.0\n\nIf you use this dataset in a research paper, please cite it using the following BibTeX:\n\n@misc{\nshoot-detection-basketball-83v91_dataset,\ntitle = { Shoot Detection Basketball Dataset },\ntype = { Open Source Dataset },\nauthor = { Basketball },\nhowpublished = { \\url{ https://universe.roboflow.com/basketball-oatw2/shoot-detection-basketball-83v91 } },\nurl = { https://universe.roboflow.com/basketball-oatw2/shoot-detection-basketball-83v91 },\njournal = { Roboflow Universe },\npublisher = { Roboflow },\nyear = { 2025 },\nmonth = { aug },\nnote = { visited on 2025-10-26 },\n}\n\n\nSIMILAR PROJECTS\nSee More\nObject Detection\naivle5_kim2\nby KTAivle5\n77 images\nClassification\nModel\nscore-no-score -single\nby Gaddy Radom\n596 images\n1 model\nObject Detection\nModel\nsnap\nyolov5\nyolov11\nyolov11n\nyolov8\nyolov8n\nopencv_abu\nby yolotest\n6137 images\n12 models\nObject Detection\nbasketball arc project\nby Lorcans projects\n731 images\nObject Detection\nModel\nsnap\nFalse Positive\nHead detect\nby jask\n9585 images\n1 model\n© 2025 Roboflow, Inc. All rights reserved.\nExplore Datasets and Models\nObject Detection\nImage Classification\nMultimodal\nInstance Segmentation\nResearch\nTrending\nExplore Use Cases\nConstruction\nDocuments\nManufacturing\nRobotics\nSelf Driving\nSports\nResources\nProduct Overview\nPricing\nDocumentation\nBlog\nYouTube\nSupport\nForum\nCompany\nCareers\nPress\nTerms of Use\nPrivacy",
    "tags": [
      "False Positive"
    ],
    "classes": [
      "Overview",
      "Images",
      "Dataset",
      "Analytics",
      "Model",
      "API Docs",
      "0\n1\n2\n3\n4\n5\n6",
      "0",
      "1",
      "2",
      "3",
      "4",
      "5",
      "6"
    ],
    "description": "N/A",
    "api_endpoint": "@misc{\nshoot-detection-basketball-83v91_dataset,\ntitle = { Shoot Detection Basketball Dataset },\ntype = { Open Source Dataset },\nauthor = { Basketball },\nhowpublished = { \\url{ https://universe.roboflow.com/basketball-oatw2/shoot-detection-basketball-83v91 } },\nurl = { https://universe.roboflow.com/basketball-oatw2/shoot-detection-basketball-83v91 },\njournal = { Roboflow Universe },\npublisher = { Roboflow },\nyear = { 2025 },\nmonth = { aug },\nnote = { visited on 2025-10-26 },\n}\n",
    "model_identifier": "@misc{shoot-detection-basketball-83v91_dataset,title = { Shoot Detection Basketball Dataset },type = { Open Source Dataset },author = { Basketball },howpublished = { \\url{ https://universe.roboflow.com/basketball-oatw2/shoot-detection-basketball-83v91 } },url = { https://universe.roboflow.com/basketball-oatw2/shoot-detection-basketball-83v91 },journal = { Roboflow Universe },publisher = { Roboflow },year = { 2025 },month = { aug },note = { visited on 2025-10-26 },}"
  },
  {
    "project_title": "basketball detection Computer Vision Model",
    "url": "https://universe.roboflow.com/hotshot/basketball-detection-tqwcs",
    "author": "by Videocites",
    "project_type": "N/A",
    "updated": "Go to Roboflow App\nUniverse Home\nSign In or Sign Up\nRoboflow App\nDocumentation\nUniverse\nBack\nbasketball detection\nObject Detection\nGENERAL\nOverview\nDATA\nImages\n7432\nDataset\n7\nAnalytics\nDEPLOY\nModel\n2\nAPI Docs\n7.4k images\nbasketball detection Computer Vision Model\nHotShot\n\nUpdated 3 months ago\n\nUse this Model\nUse this Dataset\n3 stars\n\n809\n\nviews\n\n48\n\ndownloads\nTAGS\nObject Detection\nModel\nsnap\nCLASSES (2)\nbasketball\nbasketball-hoop\nMETRICS\nTry This Model\nDrop an image or\nbrowse your device\nA description for this project has not been published yet.\nCite This Project\nLICENSE\nCC BY 4.0\n\nIf you use this dataset in a research paper, please cite it using the following BibTeX:\n\n@misc{\nbasketball-detection-tqwcs_dataset,\ntitle = { basketball detection Dataset },\ntype = { Open Source Dataset },\nauthor = { HotShot },\nhowpublished = { \\url{ https://universe.roboflow.com/hotshot/basketball-detection-tqwcs } },\nurl = { https://universe.roboflow.com/hotshot/basketball-detection-tqwcs },\njournal = { Roboflow Universe },\npublisher = { Roboflow },\nyear = { 2025 },\nmonth = { aug },\nnote = { visited on 2025-10-26 },\n}\n\n\nSIMILAR PROJECTS\nSee More\nObject Detection\nNBA-Dataset-7\nby Videocites\n2997 images\nObject Detection\nbasketball player detection\nby neural network\n221 images\nObject Detection\nbsk-test\nby test\n311 images\nObject Detection\nbasketball ball\nby gaga lala\n1956 images\nObject Detection\nbb\nby RD\n1089 images\n© 2025 Roboflow, Inc. All rights reserved.\nExplore Datasets and Models\nObject Detection\nImage Classification\nMultimodal\nInstance Segmentation\nResearch\nTrending\nExplore Use Cases\nConstruction\nDocuments\nManufacturing\nRobotics\nSelf Driving\nSports\nResources\nProduct Overview\nPricing\nDocumentation\nBlog\nYouTube\nSupport\nForum\nCompany\nCareers\nPress\nTerms of Use\nPrivacy",
    "mAP": "N/A",
    "precision": "N/A",
    "recall": "N/A",
    "training_images": "Go to Roboflow App\nUniverse Home\nSign In or Sign Up\nRoboflow App\nDocumentation\nUniverse\nBack\nbasketball detection\nObject Detection\nGENERAL\nOverview\nDATA\nImages\n7432\nDataset\n7\nAnalytics\nDEPLOY\nModel\n2\nAPI Docs\n7.4k images\nbasketball detection Computer Vision Model\nHotShot\n\nUpdated 3 months ago\n\nUse this Model\nUse this Dataset\n3 stars\n\n809\n\nviews\n\n48\n\ndownloads\nTAGS\nObject Detection\nModel\nsnap\nCLASSES (2)\nbasketball\nbasketball-hoop\nMETRICS\nTry This Model\nDrop an image or\nbrowse your device\nA description for this project has not been published yet.\nCite This Project\nLICENSE\nCC BY 4.0\n\nIf you use this dataset in a research paper, please cite it using the following BibTeX:\n\n@misc{\nbasketball-detection-tqwcs_dataset,\ntitle = { basketball detection Dataset },\ntype = { Open Source Dataset },\nauthor = { HotShot },\nhowpublished = { \\url{ https://universe.roboflow.com/hotshot/basketball-detection-tqwcs } },\nurl = { https://universe.roboflow.com/hotshot/basketball-detection-tqwcs },\njournal = { Roboflow Universe },\npublisher = { Roboflow },\nyear = { 2025 },\nmonth = { aug },\nnote = { visited on 2025-10-26 },\n}\n\n\nSIMILAR PROJECTS\nSee More\nObject Detection\nNBA-Dataset-7\nby Videocites\n2997 images\nObject Detection\nbasketball player detection\nby neural network\n221 images\nObject Detection\nbsk-test\nby test\n311 images\nObject Detection\nbasketball ball\nby gaga lala\n1956 images\nObject Detection\nbb\nby RD\n1089 images\n© 2025 Roboflow, Inc. All rights reserved.\nExplore Datasets and Models\nObject Detection\nImage Classification\nMultimodal\nInstance Segmentation\nResearch\nTrending\nExplore Use Cases\nConstruction\nDocuments\nManufacturing\nRobotics\nSelf Driving\nSports\nResources\nProduct Overview\nPricing\nDocumentation\nBlog\nYouTube\nSupport\nForum\nCompany\nCareers\nPress\nTerms of Use\nPrivacy",
    "tags": [],
    "classes": [
      "Overview",
      "Images",
      "Dataset",
      "Analytics",
      "Model",
      "API Docs",
      "basketball\nbasketball-hoop",
      "basketball",
      "basketball-hoop"
    ],
    "description": "Drop an image or\nbrowse your device",
    "api_endpoint": "@misc{\nbasketball-detection-tqwcs_dataset,\ntitle = { basketball detection Dataset },\ntype = { Open Source Dataset },\nauthor = { HotShot },\nhowpublished = { \\url{ https://universe.roboflow.com/hotshot/basketball-detection-tqwcs } },\nurl = { https://universe.roboflow.com/hotshot/basketball-detection-tqwcs },\njournal = { Roboflow Universe },\npublisher = { Roboflow },\nyear = { 2025 },\nmonth = { aug },\nnote = { visited on 2025-10-26 },\n}\n",
    "model_identifier": "@misc{basketball-detection-tqwcs_dataset,title = { basketball detection Dataset },type = { Open Source Dataset },author = { HotShot },howpublished = { \\url{ https://universe.roboflow.com/hotshot/basketball-detection-tqwcs } },url = { https://universe.roboflow.com/hotshot/basketball-detection-tqwcs },journal = { Roboflow Universe },publisher = { Roboflow },year = { 2025 },month = { aug },note = { visited on 2025-10-26 },}"
  },
  {
    "project_title": "Basketball detection Computer Vision Model",
    "url": "https://universe.roboflow.com/robot-hwacq/basketball-detection-dsm0h",
    "author": "by Marmara University",
    "project_type": "N/A",
    "updated": "Go to Roboflow App\nUniverse Home\nSign In or Sign Up\nRoboflow App\nDocumentation\nUniverse\nBack\nBasketball detection\nObject Detection\nGENERAL\nOverview\nDATA\nImages\n2558\nDataset\n1\nAnalytics\nDEPLOY\nModel\n1\nAPI Docs\n2.6k images\nBasketball detection Computer Vision Model\nRobot\n\nUpdated 2 years ago\n\nUse this Model\nUse this Dataset\n1 star\n\n104\n\nviews\n\n4\n\ndownloads\nTAGS\nObject Detection\nModel\nsnap\nCLASSES (3)\nbasketball\nrim\nsports ball\nMETRICS\nTry This Model\nDrop an image or\nbrowse your device\nA description for this project has not been published yet.\nCite This Project\nLICENSE\nMIT\n\nIf you use this dataset in a research paper, please cite it using the following BibTeX:\n\n@misc{\nbasketball-detection-dsm0h_dataset,\ntitle = { Basketball detection Dataset },\ntype = { Open Source Dataset },\nauthor = { Robot },\nhowpublished = { \\url{ https://universe.roboflow.com/robot-hwacq/basketball-detection-dsm0h } },\nurl = { https://universe.roboflow.com/robot-hwacq/basketball-detection-dsm0h },\njournal = { Roboflow Universe },\npublisher = { Roboflow },\nyear = { 2023 },\nmonth = { oct },\nnote = { visited on 2025-10-26 },\n}\n\n\nSIMILAR PROJECTS\nSee More\nObject Detection\nbest_basketball_shot\nby Marmara University\n2595 images\nObject Detection\nBall and Hoop\nby project01\n2086 images\nObject Detection\nModel\nsnap\nbasketball_ai\nby ankworkspace\n2887 images\n1 model\nObject Detection\nModel\nsnap\nBasquet\nby TT\n3326 images\n2 models\nObject Detection\nModel\nsnap\nBalones de basquetbol\nby TT\n2559 images\n1 model\n© 2025 Roboflow, Inc. All rights reserved.\nExplore Datasets and Models\nObject Detection\nImage Classification\nMultimodal\nInstance Segmentation\nResearch\nTrending\nExplore Use Cases\nConstruction\nDocuments\nManufacturing\nRobotics\nSelf Driving\nSports\nResources\nProduct Overview\nPricing\nDocumentation\nBlog\nYouTube\nSupport\nForum\nCompany\nCareers\nPress\nTerms of Use\nPrivacy",
    "mAP": "N/A",
    "precision": "N/A",
    "recall": "N/A",
    "training_images": "Go to Roboflow App\nUniverse Home\nSign In or Sign Up\nRoboflow App\nDocumentation\nUniverse\nBack\nBasketball detection\nObject Detection\nGENERAL\nOverview\nDATA\nImages\n2558\nDataset\n1\nAnalytics\nDEPLOY\nModel\n1\nAPI Docs\n2.6k images\nBasketball detection Computer Vision Model\nRobot\n\nUpdated 2 years ago\n\nUse this Model\nUse this Dataset\n1 star\n\n104\n\nviews\n\n4\n\ndownloads\nTAGS\nObject Detection\nModel\nsnap\nCLASSES (3)\nbasketball\nrim\nsports ball\nMETRICS\nTry This Model\nDrop an image or\nbrowse your device\nA description for this project has not been published yet.\nCite This Project\nLICENSE\nMIT\n\nIf you use this dataset in a research paper, please cite it using the following BibTeX:\n\n@misc{\nbasketball-detection-dsm0h_dataset,\ntitle = { Basketball detection Dataset },\ntype = { Open Source Dataset },\nauthor = { Robot },\nhowpublished = { \\url{ https://universe.roboflow.com/robot-hwacq/basketball-detection-dsm0h } },\nurl = { https://universe.roboflow.com/robot-hwacq/basketball-detection-dsm0h },\njournal = { Roboflow Universe },\npublisher = { Roboflow },\nyear = { 2023 },\nmonth = { oct },\nnote = { visited on 2025-10-26 },\n}\n\n\nSIMILAR PROJECTS\nSee More\nObject Detection\nbest_basketball_shot\nby Marmara University\n2595 images\nObject Detection\nBall and Hoop\nby project01\n2086 images\nObject Detection\nModel\nsnap\nbasketball_ai\nby ankworkspace\n2887 images\n1 model\nObject Detection\nModel\nsnap\nBasquet\nby TT\n3326 images\n2 models\nObject Detection\nModel\nsnap\nBalones de basquetbol\nby TT\n2559 images\n1 model\n© 2025 Roboflow, Inc. All rights reserved.\nExplore Datasets and Models\nObject Detection\nImage Classification\nMultimodal\nInstance Segmentation\nResearch\nTrending\nExplore Use Cases\nConstruction\nDocuments\nManufacturing\nRobotics\nSelf Driving\nSports\nResources\nProduct Overview\nPricing\nDocumentation\nBlog\nYouTube\nSupport\nForum\nCompany\nCareers\nPress\nTerms of Use\nPrivacy",
    "tags": [],
    "classes": [
      "Overview",
      "Images",
      "Dataset",
      "Analytics",
      "Model",
      "API Docs",
      "basketball\nrim\nsports ball",
      "basketball",
      "rim",
      "sports ball"
    ],
    "description": "Drop an image or\nbrowse your device",
    "api_endpoint": "@misc{\nbasketball-detection-dsm0h_dataset,\ntitle = { Basketball detection Dataset },\ntype = { Open Source Dataset },\nauthor = { Robot },\nhowpublished = { \\url{ https://universe.roboflow.com/robot-hwacq/basketball-detection-dsm0h } },\nurl = { https://universe.roboflow.com/robot-hwacq/basketball-detection-dsm0h },\njournal = { Roboflow Universe },\npublisher = { Roboflow },\nyear = { 2023 },\nmonth = { oct },\nnote = { visited on 2025-10-26 },\n}\n",
    "model_identifier": "@misc{basketball-detection-dsm0h_dataset,title = { Basketball detection Dataset },type = { Open Source Dataset },author = { Robot },howpublished = { \\url{ https://universe.roboflow.com/robot-hwacq/basketball-detection-dsm0h } },url = { https://universe.roboflow.com/robot-hwacq/basketball-detection-dsm0h },journal = { Roboflow Universe },publisher = { Roboflow },year = { 2023 },month = { oct },note = { visited on 2025-10-26 },}"
  },
  {
    "project_title": "Basketball detection Computer Vision Model",
    "url": "https://universe.roboflow.com/computer-vision-d5fjh/basketball-detection-dn6fg",
    "author": "by mydataset",
    "project_type": "N/A",
    "updated": "Go to Roboflow App\nUniverse Home\nSign In or Sign Up\nRoboflow App\nDocumentation\nUniverse\nBack\nBasketball detection\nObject Detection\nGENERAL\nOverview\nDATA\nImages\n4900\nDataset\n4\nAnalytics\nDEPLOY\nModel\n4\nAPI Docs\n4.9k images\nBasketball detection Computer Vision Model\nComputer vision\n\nUpdated 2 years ago\n\nUse this Model\nUse this Dataset\n1 star\n\n858\n\nviews\n\n52\n\ndownloads\nTAGS\nObject Detection\nModel\nyolov8\nyolov8s\nsnap\nyolov8l\nCLASSES (3)\nball\nbasket\nperson\nMETRICS\nTry This Model\nDrop an image or\nbrowse your device\nDESCRIPTION\n\nDataset for detecting person, ball and basketball hoop on the picture.\n\nCite This Project\nLICENSE\nCC BY 4.0\n\nIf you use this dataset in a research paper, please cite it using the following BibTeX:\n\n@misc{\nbasketball-detection-dn6fg_dataset,\ntitle = { Basketball detection Dataset },\ntype = { Open Source Dataset },\nauthor = { Computer vision },\nhowpublished = { \\url{ https://universe.roboflow.com/computer-vision-d5fjh/basketball-detection-dn6fg } },\nurl = { https://universe.roboflow.com/computer-vision-d5fjh/basketball-detection-dn6fg },\njournal = { Roboflow Universe },\npublisher = { Roboflow },\nyear = { 2024 },\nmonth = { apr },\nnote = { visited on 2025-10-26 },\n}\n\n\nSIMILAR PROJECTS\nSee More\nObject Detection\nModel\nyolov5\nrobo_25\nby mydataset\n102 images\n3 models\nObject Detection\nModel\nsnap\nbasketball\nby basketball\n7486 images\n1 model\nObject Detection\nball\nby Rikuto\n474 images\nObject Detection\nModel\nsnap\nbasketball\nby Rikuto\n392 images\n1 model\nObject Detection\nModel\nsnap\nhoopsdetector\nby 3dsports\n225 images\n2 models\n© 2025 Roboflow, Inc. All rights reserved.\nExplore Datasets and Models\nObject Detection\nImage Classification\nMultimodal\nInstance Segmentation\nResearch\nTrending\nExplore Use Cases\nConstruction\nDocuments\nManufacturing\nRobotics\nSelf Driving\nSports\nResources\nProduct Overview\nPricing\nDocumentation\nBlog\nYouTube\nSupport\nForum\nCompany\nCareers\nPress\nTerms of Use\nPrivacy",
    "mAP": "N/A",
    "precision": "N/A",
    "recall": "N/A",
    "training_images": "Go to Roboflow App\nUniverse Home\nSign In or Sign Up\nRoboflow App\nDocumentation\nUniverse\nBack\nBasketball detection\nObject Detection\nGENERAL\nOverview\nDATA\nImages\n4900\nDataset\n4\nAnalytics\nDEPLOY\nModel\n4\nAPI Docs\n4.9k images\nBasketball detection Computer Vision Model\nComputer vision\n\nUpdated 2 years ago\n\nUse this Model\nUse this Dataset\n1 star\n\n858\n\nviews\n\n52\n\ndownloads\nTAGS\nObject Detection\nModel\nyolov8\nyolov8s\nsnap\nyolov8l\nCLASSES (3)\nball\nbasket\nperson\nMETRICS\nTry This Model\nDrop an image or\nbrowse your device\nDESCRIPTION\n\nDataset for detecting person, ball and basketball hoop on the picture.\n\nCite This Project\nLICENSE\nCC BY 4.0\n\nIf you use this dataset in a research paper, please cite it using the following BibTeX:\n\n@misc{\nbasketball-detection-dn6fg_dataset,\ntitle = { Basketball detection Dataset },\ntype = { Open Source Dataset },\nauthor = { Computer vision },\nhowpublished = { \\url{ https://universe.roboflow.com/computer-vision-d5fjh/basketball-detection-dn6fg } },\nurl = { https://universe.roboflow.com/computer-vision-d5fjh/basketball-detection-dn6fg },\njournal = { Roboflow Universe },\npublisher = { Roboflow },\nyear = { 2024 },\nmonth = { apr },\nnote = { visited on 2025-10-26 },\n}\n\n\nSIMILAR PROJECTS\nSee More\nObject Detection\nModel\nyolov5\nrobo_25\nby mydataset\n102 images\n3 models\nObject Detection\nModel\nsnap\nbasketball\nby basketball\n7486 images\n1 model\nObject Detection\nball\nby Rikuto\n474 images\nObject Detection\nModel\nsnap\nbasketball\nby Rikuto\n392 images\n1 model\nObject Detection\nModel\nsnap\nhoopsdetector\nby 3dsports\n225 images\n2 models\n© 2025 Roboflow, Inc. All rights reserved.\nExplore Datasets and Models\nObject Detection\nImage Classification\nMultimodal\nInstance Segmentation\nResearch\nTrending\nExplore Use Cases\nConstruction\nDocuments\nManufacturing\nRobotics\nSelf Driving\nSports\nResources\nProduct Overview\nPricing\nDocumentation\nBlog\nYouTube\nSupport\nForum\nCompany\nCareers\nPress\nTerms of Use\nPrivacy",
    "tags": [],
    "classes": [
      "Overview",
      "Images",
      "Dataset",
      "Analytics",
      "Model",
      "API Docs",
      "ball\nbasket\nperson",
      "ball",
      "basket",
      "person"
    ],
    "description": "Drop an image or\nbrowse your device",
    "api_endpoint": "@misc{\nbasketball-detection-dn6fg_dataset,\ntitle = { Basketball detection Dataset },\ntype = { Open Source Dataset },\nauthor = { Computer vision },\nhowpublished = { \\url{ https://universe.roboflow.com/computer-vision-d5fjh/basketball-detection-dn6fg } },\nurl = { https://universe.roboflow.com/computer-vision-d5fjh/basketball-detection-dn6fg },\njournal = { Roboflow Universe },\npublisher = { Roboflow },\nyear = { 2024 },\nmonth = { apr },\nnote = { visited on 2025-10-26 },\n}\n",
    "model_identifier": "@misc{basketball-detection-dn6fg_dataset,title = { Basketball detection Dataset },type = { Open Source Dataset },author = { Computer vision },howpublished = { \\url{ https://universe.roboflow.com/computer-vision-d5fjh/basketball-detection-dn6fg } },url = { https://universe.roboflow.com/computer-vision-d5fjh/basketball-detection-dn6fg },journal = { Roboflow Universe },publisher = { Roboflow },year = { 2024 },month = { apr },note = { visited on 2025-10-26 },}"
  },
  {
    "project_title": "Basketball Detection Computer Vision Dataset",
    "url": "https://universe.roboflow.com/basketballrobot/basketball-detection-stlnh",
    "author": "by datasets",
    "project_type": "@misc{\nbasketball-detection-stlnh_dataset,\ntitle = { Basketball Detection Dataset },\ntype = { Open Source Dataset },\nauthor = { basketballrobot },\nhowpublished = { \\url{ https://universe.roboflow.com/basketballrobot/basketball-detection-stlnh } },\nurl = { https://universe.roboflow.com/basketballrobot/basketball-detection-stlnh },\njournal = { Roboflow Universe },\npublisher = { Roboflow },\nyear = { 2022 },\nmonth = { oct },\nnote = { visited on 2025-10-26 },\n}",
    "updated": "Go to Roboflow App\nUniverse Home\nSign In or Sign Up\nRoboflow App\nDocumentation\nUniverse\nBack\nBasketball Detection\nObject Detection\nGENERAL\nOverview\nDATA\nImages\n1412\nDataset\n5\nAnalytics\nDEPLOY\nModel\n0\nAPI Docs\n1.4k images\nBasketball Detection Computer Vision Dataset\nbasketballrobot\n\nUpdated 3 years ago\n\nUse this Dataset\n1 star\n\n629\n\nviews\n\n28\n\ndownloads\nTAGS\nObject Detection\nCLASSES (3)\nbasketballblue\nbasketballred\nvolleyball\nA description for this project has not been published yet.\nCite This Project\nLICENSE\nMIT\n\nIf you use this dataset in a research paper, please cite it using the following BibTeX:\n\n\n\n@misc{\nbasketball-detection-stlnh_dataset,\ntitle = { Basketball Detection Dataset },\ntype = { Open Source Dataset },\nauthor = { basketballrobot },\nhowpublished = { \\url{ https://universe.roboflow.com/basketballrobot/basketball-detection-stlnh } },\nurl = { https://universe.roboflow.com/basketballrobot/basketball-detection-stlnh },\njournal = { Roboflow Universe },\npublisher = { Roboflow },\nyear = { 2022 },\nmonth = { oct },\nnote = { visited on 2025-10-26 },\n}\n\n\nSIMILAR PROJECTS\nSee More\nObject Detection\nbasketball\nby datasets\n1513 images\nObject Detection\n1491-1566\nby 1\n76 images\nObject Detection\nyolov3\nby ChengYu Deng\n292 images\nObject Detection\n篮球\nby\n193 images\nObject Detection\nBasketball Detection Valid\nby basketballrobot\n303 images\n© 2025 Roboflow, Inc. All rights reserved.\nExplore Datasets and Models\nObject Detection\nImage Classification\nMultimodal\nInstance Segmentation\nResearch\nTrending\nExplore Use Cases\nConstruction\nDocuments\nManufacturing\nRobotics\nSelf Driving\nSports\nResources\nProduct Overview\nPricing\nDocumentation\nBlog\nYouTube\nSupport\nForum\nCompany\nCareers\nPress\nTerms of Use\nPrivacy",
    "mAP": "N/A",
    "precision": "N/A",
    "recall": "N/A",
    "training_images": "Go to Roboflow App\nUniverse Home\nSign In or Sign Up\nRoboflow App\nDocumentation\nUniverse\nBack\nBasketball Detection\nObject Detection\nGENERAL\nOverview\nDATA\nImages\n1412\nDataset\n5\nAnalytics\nDEPLOY\nModel\n0\nAPI Docs\n1.4k images\nBasketball Detection Computer Vision Dataset\nbasketballrobot\n\nUpdated 3 years ago\n\nUse this Dataset\n1 star\n\n629\n\nviews\n\n28\n\ndownloads\nTAGS\nObject Detection\nCLASSES (3)\nbasketballblue\nbasketballred\nvolleyball\nA description for this project has not been published yet.\nCite This Project\nLICENSE\nMIT\n\nIf you use this dataset in a research paper, please cite it using the following BibTeX:\n\n\n\n@misc{\nbasketball-detection-stlnh_dataset,\ntitle = { Basketball Detection Dataset },\ntype = { Open Source Dataset },\nauthor = { basketballrobot },\nhowpublished = { \\url{ https://universe.roboflow.com/basketballrobot/basketball-detection-stlnh } },\nurl = { https://universe.roboflow.com/basketballrobot/basketball-detection-stlnh },\njournal = { Roboflow Universe },\npublisher = { Roboflow },\nyear = { 2022 },\nmonth = { oct },\nnote = { visited on 2025-10-26 },\n}\n\n\nSIMILAR PROJECTS\nSee More\nObject Detection\nbasketball\nby datasets\n1513 images\nObject Detection\n1491-1566\nby 1\n76 images\nObject Detection\nyolov3\nby ChengYu Deng\n292 images\nObject Detection\n篮球\nby\n193 images\nObject Detection\nBasketball Detection Valid\nby basketballrobot\n303 images\n© 2025 Roboflow, Inc. All rights reserved.\nExplore Datasets and Models\nObject Detection\nImage Classification\nMultimodal\nInstance Segmentation\nResearch\nTrending\nExplore Use Cases\nConstruction\nDocuments\nManufacturing\nRobotics\nSelf Driving\nSports\nResources\nProduct Overview\nPricing\nDocumentation\nBlog\nYouTube\nSupport\nForum\nCompany\nCareers\nPress\nTerms of Use\nPrivacy",
    "tags": [
      "@misc{\nbasketball-detection-stlnh_dataset,\ntitle = { Basketball Detection Dataset },\ntype = { Open Source Dataset },\nauthor = { basketballrobot },\nhowpublished = { \\url{ https://universe.roboflow.com/basketballrobot/basketball-detection-stlnh } },\nurl = { https://universe.roboflow.com/basketballrobot/basketball-detection-stlnh },\njournal = { Roboflow Universe },\npublisher = { Roboflow },\nyear = { 2022 },\nmonth = { oct },\nnote = { visited on 2025-10-26 },\n}",
      "highlighted",
      "{{language}}",
      "{{language}}"
    ],
    "classes": [
      "Overview",
      "Images",
      "Dataset",
      "Analytics",
      "Model",
      "API Docs",
      "basketballblue\nbasketballred\nvolleyball",
      "basketballblue",
      "basketballred",
      "volleyball"
    ],
    "description": "N/A",
    "api_endpoint": "@misc{\nbasketball-detection-stlnh_dataset,\ntitle = { Basketball Detection Dataset },\ntype = { Open Source Dataset },\nauthor = { basketballrobot },\nhowpublished = { \\url{ https://universe.roboflow.com/basketballrobot/basketball-detection-stlnh } },\nurl = { https://universe.roboflow.com/basketballrobot/basketball-detection-stlnh },\njournal = { Roboflow Universe },\npublisher = { Roboflow },\nyear = { 2022 },\nmonth = { oct },\nnote = { visited on 2025-10-26 },\n}\n",
    "model_identifier": "@misc{basketball-detection-stlnh_dataset,title = { Basketball Detection Dataset },type = { Open Source Dataset },author = { basketballrobot },howpublished = { \\url{ https://universe.roboflow.com/basketballrobot/basketball-detection-stlnh } },url = { https://universe.roboflow.com/basketballrobot/basketball-detection-stlnh },journal = { Roboflow Universe },publisher = { Roboflow },year = { 2022 },month = { oct },note = { visited on 2025-10-26 },}"
  }
]